Тараканы;http://inostrankabooks.ru/img/book/w240/978-5-389-11464-7.jpg;Авторская серия Ю Несбё ;Ю Несбё; Посол Норвегии найден убитым в бангкокском борделе. В Осло спешат замять скандал и командируют в Таиланд инспектора полиции Харри Холе, которому предстоит провести конфиденциальное расследование. Оказавшись в злачных местах Бангкока, среди опиумных домов и стрип-баров, Харри постепенно обнаруживает, что в деле с убийством далеко не все так очевидно, как казалось вначале. Тараканы шуршат за плинтусами. Кто-то притаился во тьме, и этот кто-то не выносит дневного света.Хронология серии детективов о Харри Холе:1.	Нетопырь2.	Тараканы3.	Красношейка4.	Немезида5.	Пентаграмма6.	Спаситель7.	Снеговик8.	Леопард 9.	Призрак 10. Полиция;http://inostrankabooks.ru/ru/book/25467/
Эдокко;http://inostrankabooks.ru/img/book/w240/978-5-389-00845-8.jpg;Отдельные проекты ;Исаак Шапиро; «Эдокко» значит «уроженец Токио». Исаак Шапиро имеет полное право называть себя так, потому что он действительно родился (в 1931 году) в японской столице. Как вышло, что мальчик из интеллигентной русско-еврейской семьи, до пяти лет говоривший дома только по-русски, оказался «коренным токийцем», пережившим американские бомбардировки? А потом стал преуспевающим американским юристом? История эта необычна и характерна одновременно. «Как много потеряла Россия оттого, что интеллигенции пришлось эмигрировать!» — заметил Михаил Горбачев, услышав ее из уст автора. Теперь эта история доступна всем российским читателям.2010-07-21История, рассказанная автором, может показаться выдумкой: это рассказ еврейского мальчика, который все детство (1931–1946 годы) провел в Японии	2010-07-21Это восток глазами русского еврея, что уже необычно и вызывает интерес	2010-07-16Еврейское счастье	2010-05-28Книга Исаака Шапиро «Эдокко» вышла в издательстве «Колибри». Эдокко по-японски – сын Эдо, как назывался Токио, до того, как в 1868 году стал японской столицей. «Мои дедушка и бабушка, -- пишет автор, -- стали первыми Шапиро, поселившимися в Японии.	;http://inostrankabooks.ru/ru/book/1172/
На службе зла;http://inostrankabooks.ru/img/book/w240/978-5-389-11220-9.jpg;Иностранная литература. Современная классика ;Роберт Гэлбрейт; Робин Эллакотт получает с курьером таинственный пакет - в котором обнаруживается отрезанная женская нога.Ее начальник, частный детектив Корморан Страйк, не так удивлен - но встревожен не меньше. В его прошлом есть четыре возможных кандидатуры на личность отправителя - и каждый из четверых способен на немыслимую жестокость.Полиция сосредоточивает усилия на поиске одного из этих четверых - но Страйк чем дальше, тем больше уверен, что именно этот подозреваемый ни при чем. Вдвоем с Робин они вынуждены взять дело в свои руки и погрузиться в пучины исковерканной психики остальных троих подозреваемых. Но таинственный убийца наносит новые удары, и Страйк с Робин понимают, что их время на исходе...«На службе зла» - дьявольски увлекательный роман-загадка с множеством неожиданных сюжетных поворотов, а также - история мужчины и женщины, пребывающих на перепутье как в профессиональном плане, так и в том, что касается личных отношений.;http://inostrankabooks.ru/ru/book/25272/
Карта родины;http://inostrankabooks.ru/img/book/w240/978-5-98720-032-2.jpg;Отдельные проекты ;Петр Вайль;2007-03-23В последнее время в интернете появились сервисы для создания собственных карт: на карте города, страны, континента можно расставить маячки – там то была услышана такая-то песня, а вот там одна девушка... Эта личная география набирает чрезвычайную популярность. Петр Вайль делает то же самое, но по старинке: его книга "Карта родины" – это, собственно, и есть собрание маячков, только в виде путевых очерков со всей территории бывшего Советского Союза.	;http://inostrankabooks.ru/ru/book/1142/
Нетопырь;http://inostrankabooks.ru/img/book/w240/978-5-389-08979-2.jpg;Авторская серия Ю Несбё ;Ю Несбё; Харри Холе прилетает в Сидней, чтобы помочь в расследовании зверского убийства норвежской подданной. Австралийская полиция не принимает его всерьез, а между тем дело гораздо сложнее, чем может показаться на первый взгляд. Древние легенды аборигенов оживают, дух смерти распростер над землей черные крылья летучей мыши, и Харри, подобно герою, победившему страшного змея Буббура, предстоит вступить в схватку с коварным врагом, чтобы одолеть зло и отомстить за смерть возлюбленной. Это дело станет для Харри началом его несколько эксцентрической полицейской карьеры, а для его создателя, Ю Несбё, — первым шагом навстречу головокружительной мировой славе.Хронология серии детективов о Харри Холе:1.Нетопырь. 2.Тараканы. 3.Красношейка. 4.Немезида. 5.Пентаграмма. 6.Спаситель. 7.Снеговик. 8.Леопард. 9.Призрак. 10.Полиция.;http://inostrankabooks.ru/ru/book/22519/
Ушедший мир;http://inostrankabooks.ru/img/book/w240/978-5-389-09959-3.jpg;Иностранная литература. Современная классика ;Деннис Лихэйн; Впервые на русском — новое панорамно-лирическое полотно современного классика Денниса Лихэйна, автора бестселлеров «Таинственная река» и «Остров проклятых», а также эпоса «Настанет день» — первой в новом веке заявки на пресловутый «великий американский роман» — и его продолжения «Ночь — мой дом». Писатель, которого называли «наследником Джона Стейнбека и Рэймонда Чандлера», решил сыграть на поле «Крестного отца» и «Однажды в Америке» — и выступил очень уверенно.Джо Коглин — сын капитана бостонской полиции Томаса Коглина и младший брат бывшего патрульного Дэнни Коглина, уже известных читателю по роману «Настанет день». Джо пошел иным путем и за десятилетие, описанное в романе «Ночь — мой дом», стал из бунтаря-одиночки, которому закон не писан, руководителем крупнейшей в регионе бутлегерской операции, правой рукой главаря гангстерского синдиката. Прошло еще десять лет, сухой закон давно отменили, за океаном бушует Вторая мировая война. Джо в одиночку растит сына и курсирует между Флоридой и Кубой — родиной его погибшей жены. Он чувствует себя своим и в великосветских салонах, и среди мафиози, и в офицерском клубе военной разведки. Но ничто не защитит его от темной тайны преступного прошлого…;http://inostrankabooks.ru/ru/book/25294/
Террин из зайца;http://inostrankabooks.ru/img/book/w240/978-5-389-00824-3.jpg;Отдельные проекты ;Борис Гайдук;		 Эта необычная кулинарная книга, в которой каждый «рецепт» отсылает нас к известному литературному произведению, кино, сказке, песне, научному докладу или газетной статье. Умберто Эко устами своего героя, странствующего монаха Вильгельма Баскервильского, учит нас варить макароны по-францискански, Штирлиц во вражеском логове пытается выведать тайну приготовления «секретного блюда Рейха» — вестфальского горохового супа, вывезти в Швейцарию радистку Кэт и при этом избежать провала, Крестный Отец в жестокой борьбе с мафией разворачивает в Нью-Йорке сеть пиццерий, великий режиссер Николай Гоголь, создатель блокбастеров «Мертвые души» и «Мертвые души-2», рассказывает пассажи- рам поезда Москва–Киев о приготовлении украинского борща, а греческий салат готовит, разумеется, Одиссей, возвращающийся от стен поверженной Трои с трофеями в виде томатов и перца.Террин а-ля рюсс... Не пытаться угадать, что такое «террин», а состряпать что-нибудь свое, сделать морду утюгом и объявить: Террин, террин, не сомневайтесь, ваше благородие! На снежных просторах моей родины террин испокон веков готовится именно так! Любая баба вам скажет! Итак, заяц!Борис Гайдук2010-07-12Каждый «рецепт» необычной кулинарной книги Бориса Гайдука «Терин из зайца» отсылает нас к известному литературному произведению, кино, сказке, песне, научному докладу или газетной статье	2010-07-12Соловья баснями, как говорится, не кормят. Но что если мораль басни может дать пищу не только для ума, но и для желудка? Да, кулинарные книги тоже могут быть произведением искусства, но шедевральными с точки зрения литературы они становятся не всегда.	2010-07-02Стилизация кулинарных рецептов под литературные произведения или литературная пародия под видом рецептов блюд	2010-06-09Как можно совместить бизнес, любовь к готовке и страсть к писательству? 	2010-06-02Писатель Гайдук попытался совместить в повести художественную литературу и поваренную книгу. Главный герой должен за четыре часа приготовить блюдо, о котором не имеет ни малейшего понятия.	2010-06-01Книга необычных «рецептов», каждый из которых отсылает читателя к сюжету известного литературного произведения, кинофильма, сказки, песни, научного доклада или газетной статьи.	2010-04-15Эта необычная кулинарная книга, в которой каждый «рецепт» отсылает нас к известному литературному произведению, кино, сказке, песне, научному докладу или газетной статье.	2010-04-15Глава из повести Бориса Гайдука 	2010-04-13В паралитературе «для взрослых» давно известен такой специфический жанр — «старые сказки на новый лад».	;http://inostrankabooks.ru/ru/book/1191/
Спаситель;http://inostrankabooks.ru/img/book/w240/978-5-389-11197-4.jpg;Авторская серия Ю Несбё ;Ю Несбё; Пытаясь заглушить тоску по Ракели, Харри Холе с головой погружается в работу. Теперь он совсем один — коллеги его не любят, старый начальник ушел, а новый выше всего ставит дисциплину. В этом Харри не силен, зато он здорово расследует убийства. В Осло появился международный киллер, на благотворительном концерте застрелен солдат Армии спасения… Чтобы разобраться в невероятно запутанном преступлении и по-своему восстановить справедливость, Харри предстоит раскрыть немало зловещих тайн.;http://inostrankabooks.ru/ru/book/25174/
