Клонировать Христа?;http://inostrankabooks.ru/img/book/w240/978-5-389-00099-5.jpg;Отдельные проекты ;Дидье ван Ковелер; «Клонировать Христа?» - документальная книга известного французского писателя Дидье ван Ковелера, где рассказывается, как вчерашняя научная фантастика сегодня становится научной реальностью. «Здесь ничего не придумано!» - утверждает автор,  начиная повествование о событиях, развернувшихся вокруг трех христианских святынь - Туринской плащаницы, судариума из Овьедо и  Аржантёйского хитона, - якобы сохранивших на себе кровь Иисуса из Назарета, и  о том, какие неожиданные мотивы таятся за попытками установить подлинность этих реликвий. Писатель ведет расследование, порой обретающее детективные черты, разоблачает мистификации, указывает на факты намеренной лжи, замаскированной под науку. И предлагает читателям вынести собственное суждение.2008-05-19Дидье ван Ковелер (ван Ковеларт в другой транскрипции) в 2004 году выпустил роман «Евангелие от Джимми», в котором рассказал о приключениях генетической копии Христа. Через три года писатель вернулся к теме и в научно-популярной книге объясняет, как можно воссоздать Иисуса.	;http://inostrankabooks.ru/ru/book/1154/
Сказки старой Англии;http://inostrankabooks.ru/img/book/w240/978-5-389-06681-6.jpg;Иностранная литература. Большие книги ;Редьярд Киплинг; Редьярд Киплинг — знаменитый писатель, поэт и новеллист, первый англичанин, получивший Нобелевскую премию по литературе. Пожалуй, редко у кого столь удачно складывалась литературная судьба: произведения Киплинга восторженно принимались критикой, гонорары оказывались рекордными, при жизни автора было издано четыре собрания сочинений — случай поистине уникальный. «Пак с волшебных холмов» и «Подарки фей», составившие настоящий сборник, наряду с «Книгами джунглей», — самые знаменитые произведения Киплинга. Уже при жизни писателя они были переведены на двадцать семь языков! В увлекательных рассказах проказливого эльфа Пака сплетаются воедино фольклор, сказки, мифология и история, создавая неповторимую атмосферу старой доброй Англии.;http://inostrankabooks.ru/ru/book/20290/
Здесь курят;http://inostrankabooks.ru/img/book/w240/978-5-94145-364-7.jpg;The best of Иностранка ;Кристофер Бакли;2004-10-22Сергей Михалков научил нас тому, что мамы всякие нужны, мамы всякие важны. Ну, и на пап, наверное, тоже распространяется такая льгота. А потому остается лишь смириться с тем, что твой отец – главный общественный представитель Академии табачных исследований, формулируя официально. Формулируя неофициально, твой отец именно тот человек, который убеждает людей с экранов телевизоров в том, что курение чуть ли не полезно, а удовольствия, получаемые от процесса, безмерны. Человек, который умеет выкручиваться из любой ситуации и находить правильный подход ко всем героям и знаменитостям, от высказываний которых так или иначе зависит будущее табачной индустрии. 	2001-07-04Американский журналист-живчик прошел школу выживания в джунглях американских масс-медиа, познал все прелести и гадости мозгового манипулирования и обобщил жизненный опыт в этом сатирическом романе. Главный герой с отважным цинизмом и гнусным бесстыдством сражается с противниками курения на всех уровнях.	2001-05-25Народная примета: если в голливудском фильме кто-то курит (не дай Бог, главный герой!), то режиссер непременно эмигрант – поляк, югослав или на худой конец китаец. Стопроцентным англосаксам курить строго воспрещается, даже в туалете. Вот только непонятно, кто же осмеливается производить миллионы тонн табака и даже рекламировать смертоносную продукцию в странах третьего мира?	2001-04-25Позарез нужная вещь. Участник высшей лиги Очень Остроумных Текстов - которая за последний год пополнилась "Академическим обменом" Лоджа, "Профессором Криминале" Брэдбери и "Англией, Англией" Барнса. Англосаксонский юмор king-size, o-la-la without bla-bla-bla, как пишут в тамошних рекламных проспектах.	;http://inostrankabooks.ru/ru/book/769/
Часы;http://inostrankabooks.ru/img/book/w240/978-5-389-00066-7.jpg;The best of Иностранка ;Майкл Каннингем; Майкл Каннингем – блистательный американский прозаик. Именно роман “Часы” принес ему Пулитцеровскую премию и диплом автора лучшего американского романа 1999 года. А в 2002-м экранизация “Часов” с Николь Кидман, Джулианной Мур, Мерил Стрип в главных ролях обошла киноэкраны всего мира.Главная героиня романа – вдохновительница и мистический “соавтор” Каннингема, знаменитая английская писательница Вирджиния Вулф. Англия 20-х и Америка 90-х. Патриархальный Ричмонд, послевоенный Лос-Анджелес и сверхсовременный Нью-Йорк. Как устроено время? Как рождаются книги? Обо всем этом – “Часы”.Она почти бежит. В зимнем тяжелом пальто не по погоде. 1941 год. Началась новая война. Она оставила дома записки: одну Леонарду, другую Ванессе. Она спешит к реке, твердо зная, что сделает то, что задумала, но все равно невольно заглядывается на холмы, церковь, отару ослепительных, чуть отдающих в желтизну овец, щиплющих траву под темнеющими небесами. Она останавливается, смотрит на овец, потом на небо, идет дальше. Голоса не умолкают, в облаках гудят невидимые бомбардировщики. Она проходит мимо одного из работников (кажется, его зовут Джон?), крупного парня с маленькой головой, одетого в фуфайку картофельного цвета. Он чистит канаву в саженом тальнике. Парень разгибается, поднимает на нее глаза, кивает и вновь склоняется к ржавой воде. Минуя его на пути к реке, она думает, как ему повезло в жизни, какая это, в сущности, удача: чистить канаву в тальнике. А вот она потерпела крах. На самом деле никакая она не писательница — просто эксцентричная фантазерка. ;http://inostrankabooks.ru/ru/book/740/
Финанс-романс. В дебрях корпоративной Европы;http://inostrankabooks.ru/img/book/w240/978-5-389-04505-7.jpg;Отдельные проекты ;Яна Афанасьева; ЯНА АФАНАСЬЕВА родилась в Мурманской области. Профессиональный финансист. Закончила Санкт-Петербургский ФИНЭК и Университет Хельсинки. Получила степень МВА в Роттердамской Школе бизнеса.Начинала международную карьеру в Хельсинки с должности аналитика в управлении бумажного концерна StoraEnso. Несколько лет работала в Бонне в финансовом управлении группы Deutsche Post, известной в России под торговой маркой DHL, и в Люксембурге, в штаб-квартире сталелитейного гиганта ArcelorMittal.В настоящее время управляет финансовыми и законодательными рисками европейских операций Amazon.com, всемирно известного лидера интернет-торговли.В чем заключается магическая сила резюме? Как вести переговоры? Как договариваться о зарплате на новом местеработы? Как возникают и к чему приводят служебные романы на верхних этажах богатых контор? Каковы рецепты,секреты и тонкости карьеры в европейских офисах? Каковы возможности россиянина на Западе? Яна Афанасьева пишет не столько про финансы, сколько про финансистов. Тем не менее читатель найдет здесь честные до резкости ответы на многие вопросы. Уехав с мужем и двумя детьми из России в конце 90-х, молодая бизнес-леди делает невероятную карьеру в Европе. Эта карьера напоминает авантюру, но построена на тонком знании психологии, правил бизнеса и обдуманной дерзости. Рассказчица с жадным интересом и удивлением наблюдает за жизнью западных корпораций, но смотрит на это глазами человека, который родился и вырос в России.;http://inostrankabooks.ru/ru/book/17334/
Как влюбиться без памяти;http://inostrankabooks.ru/img/book/w240/978-5-389-07043-1.jpg;Сесилия Ахерн ;Сесилия Ахерн; Призвание Кристины Роуз — помогать людям, и она помогает им найти работу, а заодно и свое место в жизни. Но однажды ей не удалось предотвратить чужую беду, и в собственной ее жизни наступил разлад. А может, это случилось уже давно? Кристина рассталась с мужем, и он оказался еще хуже, чем она думала. Ее детище, компания «Роуз рекрутмент», того и гляди разорится, и сотрудники окажутся на улице. А главное — как ей спасти Адама, который задумал совершить непоправимый шаг в свой день рождения? Время уже на исходе…;http://inostrankabooks.ru/ru/book/20867/
