Сыщик Галилей;http://inostrankabooks.ru/img/book/w240/978-5-389-00004-9.jpg;Лекарство от скуки ;Кэйго Хигасино; Посреди ночного города у подростка загорается голова, и в это же самое время маленькая девочка видит в воздухе красную нитку. Школьники находят в озере посмертную маску пропавшего без вести человека. Из-под воды поднимается столб огня. Душа отделяется от тела… Всякий раз, когда детектив Кусанаги, расследующий убийства, сталкивается со сверхъестественными явлениями, он спешит за помощью к своему другу-физику по прозвищу Галилей, у которого всегда находится научное объяснение тому, что, на первый взгляд, необъяснимо.«Он обернулся – на лице была маска, выкованная из серебристого металла, без выражения, маска, которую он надевал всякий раз, когда хотел скрыть свои чувства, маска, которая, изгибаясь, с удивительной точностью повторяла линии его впалых щек, лба и подбородка. Маска сияла, он держал в руках и рассматривал смертоносное оружие. Это оружие…» ;http://inostrankabooks.ru/ru/book/1019/
Вот это поцелуй!;http://inostrankabooks.ru/img/book/w240/978-5-94145-401-3.jpg;The best of Иностранка ;Филипп Джиан;2007-07-04Французу Филиппу Джиану приходилось неоднократно и подолгу жить в США. В результате в своей книге он попытался совместить сразу две традиции - американского детектива и европейского психологического романа. 	2007-06-29На родине француза Филиппа Джиана полюбили за то, что он внимательно читал американскую литературу и в своих немалочисленных романах успешно скрещивал французскую психологическую прозу с американской киноэстетикой. В "Иностранке" уже переводили одну его книгу, "Трения",-- в ней языком нуара была рассказана драма отношений между сыном и матерью. "Вот это поцелуй!" -- роман, где этот прием доведен до предела и кинематограф неотделим от литературы.В некоем городе два полицейских расследуют жестокое убийство дочери местного магната, попутно занимаясь кучей посторонних дел, и чаще всего -- сексом. Он -- сорокалетний красавец, зацикленный на отношениях с бывшей женой -- политической активисткой. Она -- девяностокилограммовая толстуха, замужем за гомосексуалистом--учителем литературы. Город между тем полон преступников, порочных красавиц и моделей-наркоманок и полярно разделен на черное и белое.	2007-06-18«Вот это поцелуй!» Филиппа Джиана, пятидесяти-с-гаком-летнего француза, питающего явную слабость к канонам американского «крутого детектива», определяют обычно как помесь нуара с современным евророманом. И то. От уэльбеков с бегбедерами здесь отчаянный секс, экзистенциальное удушье, кризис ценностей-вербальностей-коммуникаций, закат Европы вручную, невзыскательная рефлексия, в градусе письма клонящаяся к нулю. От нуара — фемм-фатали всех разновидностей, жуткое убийство, опальный герой-одиночка и сочетание условности с натурализмом, в зазоре между которыми и маячит зыбкий призрак цинично-грустной свободы. Нетрудно, впрочем, заметить, что нуар этот — генно-модифицированный, накачанный адреналином и тестостероном, получивший инъекцию и пародийной брутальности в духе Вернона Салливана, и гротескной страшносказочности в стиле «Города грехов».	2007-06-12Роман французского писателя Филиппа Джиана «Вот это поцелуй» вышел в издательстве «Иностранка». Это не первый роман Французского автора. Предыдущий назывался «Трения» -- психологический этюд на тему современной семьи, отцов и детей, невозможности наладить отношения, относительности любви и судьбы, от которой не уйти и которая, кажется, вне зависимости от желаний и стремлений человека, заставляет его раз за разом повторять один и тот же сценарий. 	2007-06-12В издательстве "Иностранка" вышли два романа французского писателя Филиппа Джиана. Подолгу живя в Америке, Джиан пишет по-американски жестко и по-европейски легко.	2007-06-11«Вот это поцелуй!» Филиппа Джиана, пятидесяти-с-гаком-летнего француза, питающего явную слабость к канонам американского «крутого детектива», определяют обычно как помесь нуара с современным евророманом. И то. От уэльбеков с бегбедерами здесь отчаянный секс, экзистенциальное удушье, кризис ценностей-вербальностей-коммуникаций, закат Европы вручную, невзыскательная рефлексия, в градусе письма клонящаяся к нулю. От нуара — фемм-фатали всех разновидностей, жуткое убийство, опальный герой-одиночка и сочетание условности с натурализмом, в зазоре между которыми и маячит зыбкий призрак цинично-грустной свободы. Нетрудно, впрочем, заметить, что нуар этот — генно-модифицированный, накачанный адреналином и тестостероном, получивший инъекцию и пародийной брутальности в духе Вернона Салливана, и гротескной страшносказочности в стиле «Города грехов».	;http://inostrankabooks.ru/ru/book/737/
Английская свадьба;http://inostrankabooks.ru/img/book/w240/978-5-389-00740-6.jpg;Отдельные проекты ;Елена Давыдова-Харвуд; Открыв книгу “Английская свадьба”, читатель неожиданно для себя обнаружит, что в Англии существуют такие обычаи и традиции, о которых он прежде и не подозревал. Такие же удивительные открытия ждали и Елену Давыдову-Харвуд, когда она вышла замуж за британца и поселилась в провинциальном городке Свонедже. Прежде чем превратиться в настоящую английскую домохозяйку, она пережила множество приключений, забавных и смешных, порой весьма странных, а иногда даже довольно неприятных. О них она и рассказывает в своей книге.2010-10-29Эта книга об удивительной стране, в которой по дорогам разгуливают длинношерстные коровы и прыгают кролики, по паркам летают стаи пестрых попугайчиков, премьер-министры ездят на работу на велосипедах, уборщик паба оказывается одновременно и владельцем заведения, а дома обходятся без тапочек.	2010-10-26Британец даже после нескольких дней, проведенных вместе с вами в баре, может не сказать своего имени.	2010-04-02Видеоматериал	2010-03-29Обычное приглашение пообедать обернулось предложением руки и сердца. 	2010-03-22Оказывается, в Англии существуют обычаи и традиции, о которых прежде и не подозревали люди, живущие за пределами благословенного туманного Альбиона. 	2010-03-01	2010-03-01В этой книге вы прочтёте о британцах то, что не найти ни в одном путеводителе.	2010-02-19	2010-02-19	2010-02-01История русской девушки, вышедшей замуж за англичанина и адаптирующейся к жизни на туманном Альбионе.	2010-01-22Однажды москвичка, бодрая и независимая журналистка, полюбила англичанина. Причем стопроцентного англичанина – с типичными британскими замашками и странностями, живущего в английской провинции и обожающего свою родную землю. Адаптация Елены Давыдовой-Харвуд к английским нравам и быту сложилась в довольно забавную книжку. Подобно герою веселого комикса, автор ринулась познавать новую жизнь – общаться с соседями, продавцами, таксистами и прочими поданными ее величества. И почти каждый раз, по законам жанра, ее ждет сюрприз, а то и несколько.	2009-12-22Замуж в Англию Елена, по ее словам, вышла совершенно случайно: ей, убежденной холостячке, надо было срочно слинять с испанской виллы, на которой назревал русский семейный скандал.	;http://inostrankabooks.ru/ru/book/1149/
Сильнее страха;http://inostrankabooks.ru/img/book/w240/978-5-389-12222-2.jpg;Левиада ;Марк Леви; Эндрю Стилмен, журналист «Нью-Йорк таймс», с трудом приходит в себя после покушения на его жизнь. У него нет сил работать, ему не удается вернуть любимую женщину. Единственная радость — чтение. Однажды он знакомится в библиотеке с серьезной и немного странной девушкой Сьюзи: она что-то упорно ищет, изучая целые горы книг. Эндрю, соскучившись по интересной работе, охотно соглашается ей помочь, даже не догадываясь, что его намеренно втянули в смертельно опасную историю.;http://inostrankabooks.ru/ru/book/26458/
Один день в Древнем Риме;http://inostrankabooks.ru/img/book/w240/978-5-389-12141-6.jpg;Города и люди ;Альберто Анджела; Древний Рим времен расцвета империи похож на современный мегаполис гораздо больше, чем мы могли бы подумать. Полтора миллиона его жителей сталкивались с теми же проблемами, что и их потомки две тысячи лет спустя: дороговизна жилья и дорожные пробки, наплыв иммигрантов и необходимость 'подмазывать' городских чиновников…Альберто Анджела – знаменитый итальянский палеонтолог, археолог, автор нескольких  бестселлеров в жанре научно-популярной литературы и познавательных телепрограмм предлагает своим читателям накрыться шапкой-невидимкой и провести целый день, от рассвета до заката, в Риме 115 года нашей эры: потолкаться на людной улице и заглянуть в Колизей, посетить судебное слушание и роскошные термы, отведать изысканных блюд и насладиться беседой на званом ужине. И закончить день на любовном ложе — здесь за две тысячи лет тоже ничего не изменилось.;http://inostrankabooks.ru/ru/book/26322/
Москва-Петербург. Станционный путеводитель;http://inostrankabooks.ru/img/book/w240/978-5-389-04443-2.jpg;Города и люди ;Алексей Митрофанов; «Станционный путеводитель» — уникальная книга, путешествие во времени и настоящий парадокс: читаешь ее со скоростью летящего «Сапсана», а подробности видишь как из окна медлительного поезда позапрошлого века.А. Г. Митрофанову, одному из лучших современных рассказчиков и знатоков нашей истории, кажется, известно все, что интересного происходило и происходит в Химках, Клину, Твери, Вышнем Волочке, Бологом и на других пунктах самого популярного железнодорожного маршрута России.Читатель посетит поместья, богатые дачи, крестьянские избы, узнает купцов, литераторов, гимназистов, чиновников, знаменитых преступников, искрометных нуворишей, оценит вольные валдайские нравы и вкусную во всех отношениях историю пожарских котлет. Рассказчик знает толк в наиболее ярких исторических эпизодах: вот борец Фосс опустошает витрину вокзального буфета, вот женщины легкого поведения на Невском дружно изображают незнакомку Блока, великий Чайковский ругает неопрятное Ховрино, в то время как аристократ Набоков играет в невинного «дурачка», а юный Паустовский рьяно ловит безбилетников в тихом Петровско-Разумовском. Издание содержит более 250 черно-белых и цветных фотографий, рисунков, гравюр, дающих простор удивлению, воображению и ностальгии.;http://inostrankabooks.ru/ru/book/18604/
Мои большие королевские свадьбы;http://inostrankabooks.ru/img/book/w240/978-5-389-02996-5.jpg;Города и люди ;Андрей Шилов; Книга дарит читателю опыт, причем не простой, а королевский: событие, которое даже для особы королевского происхождения неповторимо и невероятно волнительно, – свадьбу. Над устройством королевских свадеб – церемониями, убранством, платьем, украшениями, угощением, музыкой – веками трудятся лучшие умы и самые блестящие дарования, не только из данного королевства. В книге раскрывается потрясающая панорама самых знаменитых монарших свадеб XX и XXI веков, с историями знакомства, предсвадебными волнениями, описанием самых удивительных подробностей происходящего (дождь из гвоздик, приземление к столу на парашюте, поцелуй невестой-принцессой руки жениха-простолюдина) и с фотографиями, выполненными виртуозами жанра. Читатель перемещается из десятилетия в десятилетие, из Швеции в Японию, из Иордании в Нидерланды, из Великобритании в Испанию и видит, что в свадебной традиции принцесс все больше места занимает настоящая любовь. А ведь это для монарших союзов совершенно нехарактерно. Внимательно изучив историю королевских династий и дворов Европы и Азии, А. Шилов описывает образ жизни принцесс, их правила, привычки, привилегии и табу. Чему они учатся, с кем водятся, где работают и чем увлекаются, что едят на ужин и какие скелеты прячутся в их шкафах. Еще одна глава – описание всего, безчего невозможна настоящая королевская свадьба: выбор времени и места, подарки, кольца, устройство пира и приглашение гостей.Кроме того, издание дает перечень советов – что в королевских свадьбах можно перенять. В числе таких сведений – подробнейший рецепт фруктового торта с тамариндом, созданный Фионой Кернс, который готовится от недели до трехмесяцев (этот торт подавали на свадебном обеде в честь герцогини Кембриджской Кэтрин и принца Уильяма). Все эти уникальные истории, секреты и образы теперь принадлежат читателю.;http://inostrankabooks.ru/ru/book/18865/
Жизнь и любовь Елены;http://inostrankabooks.ru/img/book/w240/978-5-389-03561-4.jpg;Отдельные проекты ;Оксана Даровская; В первом романе Оксаны Даровской нет вымысла. Лишь литературная обработка человеческой жизни в сопровождении юмора, грусти и упрямой надежды, возникающей там, где, казалось бы, ей не осталось места. События прорисованы мягкой пастелью, без столь модных сегодня мрачного фатума, надрыва, трагизма. И что удивительно, именно эти неброские полутона отрезвляют, завораживают и… не отпускают до последней страницы. В крепкий узел Большого Города сплелись невыдуманные истории нескольких поколений женщин, ищущих счастья, но понимающих его по-разному. Перипетии их судеб будоражат, извлекая на свет множество непростых вопросов.Оттого и сюжетные линии, и стилистику омана невозможно вместить в рамки слезливо-сентиментальной женской прозы.;http://inostrankabooks.ru/ru/book/15760/
Заложник;http://inostrankabooks.ru/img/book/w240/978-5-389-07446-0.jpg;Лекарство от скуки ;Кристина Ульсон; На борту «боинга», вылетевшего из Стокгольма в Нью-Йорк, обнаружена записка о заложенной в самолете бомбе. Она взорвется, если за время рейса не будут выполнены требования террористов, одно из которых — закрыть так называемый «коттедж Теннисона», секретную тюрьму на территории Афганистана. Пока шведские спецслужбы пытаются найти организаторов теракта, американские власти запрещают самолету посадку на территории США, подозревая, что злоумышленники намерены обрушить его на Капитолий…;http://inostrankabooks.ru/ru/book/22715/
