Прятки со смертью;http://inostrankabooks.ru/img/book/w240/978-5-389-06860-5.jpg;Лекарство от скуки ;Бекки Мастерман; Хранить секреты, лгать — это ведь тоже надо уметь. То и другое становится привычкой, едва ли не пагубной зависимостью, которую невероятно трудно преодолеть даже в общении с очень близкими людьми.Бриджид Куинн пятьдесят девять лет. От прежней работы в ФБР у нее сохранились воспоминания, о которых ей очень хотелось бы избавиться, и навыки боевой выучки, которые не хотелось бы применять больше никогда. Отправленная на пенсию, Бриджид старательно убеждает себя, что замечательно обустроила свою жизнь в Тусоне с мужем и двумя собаками.Но прошлое все же вмешивается: человек по имени Флойд Линч признается в самом жутком нераскрытом деле в карьере Брид жид — исчезновении и возможном убийстве ее молодой ученицы Джессики. О той страшной ночи Флойд рассказывает такие подробности, которые никогда не выносились на публику.Происходящее должно было стать последней мрачной главой в жизни Бриджид, но работающий по этому делу агент ФБР Лаура Коулмен считает признание Флойда фальшивым, и Бриджид придется вновь погрузиться в мир насилия...Впервые на русском языке!;http://inostrankabooks.ru/ru/book/21983/
Монреальский синдром;http://inostrankabooks.ru/img/book/w240/978-5-389-06244-3.jpg;Мировой детектив ;Франк Тилье; Любитель “ужастиков” ослеп, посмотрев старую короткометражку. За странным фильмом охотятся безжалостные убийцы, а тем временем неподалеку от Гавра обнаружены пять трупов с распиленными черепами. Два следа ведут к одному преступлению, и смертельно опасное расследование навсегда соединит двух очень разных людей — комиссара Шарко и лейтенанта полиции Люси Энебель…;http://inostrankabooks.ru/ru/book/19087/
Тайна Синего имама;http://inostrankabooks.ru/img/book/w240/978-5-389-02062-7.jpg;Лекарство от скуки ;Бернар Бессон; Накануне Рождества исламские террористы бросают вызов европейским и американским спецслужбам. Лидер смертников, принявший мусульманство француз по прозвищу Синий имам, разработалтайный план операции, которая заставит содрогнуться весь мир.У раздираемых интригами и склоками сил безопасности всего сорок восемь часов, чтобы предотвратить самую страшную катастрофу в истории человечества…;http://inostrankabooks.ru/ru/book/13581/
Благоухающий цветок;http://inostrankabooks.ru/img/book/w240/978-5-389-05017-4.jpg;Романтическая коллекция ;Барбара Картленд; В доме дяди-генерала к Азалии относятся как к прислуге.В Гонконге она нашла новых друзей, а встреча с загадочнымлордом Шелдоном изменила ее жизнь, но он, случайно узнав, что девушка говорит по-русски, готов заподозрить ее в шпионаже. Во что бы то ни стало лорд Шелдон намерен раскрыть тайну Азалии — Благоухающего Цветка, как прозвали ее китайцы…;http://inostrankabooks.ru/ru/book/19305/
Изгои;http://inostrankabooks.ru/img/book/w240/978-5-94145-489-1.jpg;Лекарство от скуки ;Маргарет Мерфи; Направляясь утром на работу в благотворительную клинику доктор Грейс Чэндлер обнаруживает в мусорном контейнере труп зверски убитой девушки-афганки. Расследование по странному совпадению поручают возлюбленному Грейс, инспектору-детективу Джеффу Рикмену. Ливерпульская полиция еще не успевает выяснить имя погибшей, как заживо сжигают четверых выходцев с Востока, потом убивают литовца, который вот-вот должен получить вид на жительство. Убийца действует нагло и в конце концов «вешает» на инспектора преступление, которого тот, естественно, не совершал. Под силу ли такое простому маньяку, или дело намного страшнее?Джефф Рикмен, внимательно смотревший, как из него толчками вытекает кровь, почувствовал, что его замутило. Рот наполнился слюной, и он с трудом заставил себя перевести взгляд на балку церковного свода. Здание насквозь пропиталось запахами старого дерева, свечного воска и ладана. Аромат святости и благочестия не смогли развеять ни годы запустения, ни секуляризация .Из-под высокой готической арки западного окна воскресший Христос улыбался, простерев к нему длани. Октябрьское солнце светило сквозь цветной витраж, и красный свет лучился от ран Христовых. ;http://inostrankabooks.ru/ru/book/990/
Портрет Дориана Грея;http://inostrankabooks.ru/img/book/w240/978-5-389-02145-7.jpg;Отдельные проекты ;Оскар Уайльд; Вторая книга "Коллекции Оскара Уайльда" Художник — тот, кто создает прекрасное. Раскрыть людям себя и скрыть художника — вот к чему стремится искусство.Критик — это тот, кто способен в новой форме или новыми средствами передать свое впечатление от прекрасного. Высшая, как и низшая, форма критики — один из видов автобиографии.Те, кто в прекрасном находит дурное, — люди испорченные, и при том испорченность не делает их привлекательными. Это большой грех. Те, кто способен узреть в прекрасном его высокий смысл,—люди культурные. Они не безнадежны. Но избранник—тот, кто в прекрасном видит лишь одно: Красоту. Нет книг нравственных или безнравственных. Есть книги хорошо написанные или написанные плохо. Вот и все. Ненависть девятнадцатого века к Реализму — это ярость Калибана, увидевшего себя в зеркале. Ненависть девятнадцатого века к Романтизму—это ярость Калибана, не находящего в зеркале своего отражения.Для художника нравственная жизнь человека — лишь одна из тем его творчества. Этика же искусства — в совершенном применении несовершенных средств. Художник не стремится что-то доказывать. Доказать можно даже неоспори мые истины. Художник не моралист. Подобная склон ность художника рождает непростительную манерность стиля. Не приписывайте художнику нездоровых тенденций: ему дозволено изображать все. Мысль и Слово для художника — средства Искусства. Порок и Добродетель — материал для его творчества.Если говорить о форме, — прообразом всех искусств является искусство музыканта. Если говорить о чувстве — искусство актера. Во всяком искусстве есть то, что лежит на поверхности, и символ. Кто пытается проникнуть глубже поверхности, тот идет на риск. И кто раскрывает символ, идет на риск. В сущности, Искусство — зеркало, отражающее того, кто в него смотрится, а вовсе не жизнь. Если произведение искусства вызывает споры, — значит, в нем есть нечто новое, сложное и значительное.Пусть критики расходятся во мнениях, — художник остается верен себе. Можно простить человеку, который делает нечто полезное, если только он этим не восторгается. Тому же, кто создает бесполезное, единственным оправданием служит лишь страстная любовь к своему творению. Всякое искусство совершенно бесполезно.;http://inostrankabooks.ru/ru/book/13709/
Не было печали;http://inostrankabooks.ru/img/book/w240/978-5-389-01583-8.jpg;Лекарство от скуки ;Ю Несбё; Харри Холе оказался в затруднительном положении — и это еще мягко сказано. У себя в квартире застрелилась — или была застрелена — женщина, с которой он, кажется, провел ночь… Беда в том, что он ничего не помнит. К тому же он занимается расследованием ограбления банка — преступления почти безупречного, не считая того, что грабитель без видимой причины застрелил служащую. Холе уверен, что убийство преднамеренное, но начальство считает его простой случайностью.Врагов у Харри не счесть, многие рады подставить его, и вот ему в который раз приходится вступать в опасную игру с законом, чтобы одолеть Зло…2011-05-12Четвертая книга главного норвежского детективщика Ю Несбё о его главном персонаже — полицейском Харри Холе.	;http://inostrankabooks.ru/ru/book/115/
Дай мне шанс;http://inostrankabooks.ru/img/book/w240/978-5-389-01917-1.jpg;Отдельные проекты ;Джон Лагутски; У этой книги два автора. Алан Филпс – британский журналист, работавший в Москве специальным корреспондентом «Дейли телеграф», и Джон Лагутски – он же Ваня Пастухов, мальчик, родившийся в России, но теперь живущий в Америке. Они познакомились при самых драматичных обстоятельствах, и первый протянул второму руку помощи.Это подлинная история спасения ребенка из лап системы, которая обрекла его, сироту при живой матери, на медленную гибель в так называемом специальном учреждении. Это история о том, как сила духа, невероятная в маленьком мальчике, и его непоколебимая вера в лучшее сотворили настоящее чудо. Это история о прекрас ных людях, не умеющих закрывать гл а за на боль и страдания обездоленных детей. Это горькая история со счастливым ко нц ом, который мог бы и не наступить. Это призыв о милосердии ко всем живущим на Земле.;http://inostrankabooks.ru/ru/book/13895/
Антихриста;http://inostrankabooks.ru/img/book/w240/978-5-389-01581-4.jpg;Отдельные проекты ;Амели Нотомб; Лихо закрученный, почти детективный сюжет “Антихристы” рождает множество ассоциаций — от Библии до “Тартюфа”. И вся эта тяжелая артиллерия пущена в ход ради победы девочки-подростка над пронырливой подругой, постепенно захватывающей ее жизненное пространство. А заодно — и над самой собой, над своими иллюзиями и искушениями. Две юные героини — как почти везде у Амели Нотомб — вступают в схватку не на жизнь, а на смерть. Обеим по шестнадцать лет, но одна уже расцвела, а другая даже не верит, что это когда-нибудь произойдет. Гусеница смотрит на бабочку как завороженная, потому что красота для нее важнее всего. Но как только, опомнившись, она пускает в ход свое пока что единственное оружие — холодный ибезжалостный ум, — интрига стремительно набирает обороты.;http://inostrankabooks.ru/ru/book/145/
Вера (Миссис Владимир Набоков);http://inostrankabooks.ru/img/book/w240/978-5-389-00653-9.jpg;Отдельные проекты ;Стейси Шифф; В книге “Вера (Миссис Владимир Набоков)» Стейси Шифф (р. 1960), блистательный литературовед и биограф, рассказывает об одном из самых известных романов XX века. Это история любви Владимира Набокова и Веры Слоним, ставшей его женой и верной помощницей. Их брак продлился более полувека, и все эти годы Вера была музой Набокова, и именно ей он посвятил лучшее из того, что создал. Прочтя эту книгу, читатель поймет, какое огромное влияние оказала эта незаурядная женщина на творчество знаменитого писателя, сколь значительную роль она сыграла в его жизни.Эта биография жены классика ХХ века Владимира Набокова по существу представляет собой еще одну грань биографической литературы о самом писателе.2011-03-09Очередное доказательство того, что за каждым успешным мужчиной (если не брать в расчет Оскара Уайльда) стоит женщина. На протяжении почти полувека Вера Евсеевна Набокова, в девичестве Слоним (1902–1991) была для своего великого мужа музой, ассистентом, переводчиком, редактором, секретарем, антрепренером, шофером (Набоков так и не выучился водить), нянькой. 	2010-07-02Удивительную связь между Набоковым и его женой подчеркивали все, кто знал эту семью. Даже недоброжелатели	2010-04-12Американский биограф убедительно доказывает, что без участия Веры Набоковой проект «Владимир Набоков, гениальный писатель» не имел бы ни одного шанса на успех	2010-04-05За это деликатное, но детальное жизнеописание жены и музы Владимира Набокова американская исследовательница Стейси Шифф получила Пулитцеровскую премию.	2010-04-01Портрет жены художника	2010-03-29Ее называли "святым Себастьяном в юбке" и "лучшей в мире из писательских жен", утверждали, что знаменитый супруг "ничего бы в жизни не достиг". 	2010-03-26Биография "Миссис Владимир Набоков" дает представление об уникальном опыте супружества	;http://inostrankabooks.ru/ru/book/1173/
Компания чужаков;http://inostrankabooks.ru/img/book/w240/978-5-389-00955-4.jpg;Лекарство от скуки ;Роберт Уилсон; Карл Фосс, капитан германской военной разведки, выполняя просьбу отца — генерала, вставшего в оппозицию к Гитлеру и покончившего жизнь самоубийством, встречается с участником немецкого Сопротивления. В качестве военного атташе он попадает в Лиссабон с подпольным заданием — сообщать англичанам о работе немцев над атомной бомбой. Как представитель посольства Фосс причастен к продаже алмазов, выручка от которых должна пойти на изготовление бомбы. Сюда же под видом служащей компании «Шелл» приезжает студентка математического факультета Андреа Эспиналл. Ее задача — выяснить, как и для чего эти алмазы переправляются. Герои встретились и полюбили друг друга, но разве шпионские игры — не для волков-одиночек?2010-12-17Вопросы к автору начинаются почти с самого начала. Роберт Уилсон заходит от эпизода 1942 года, когда Альберт Шпеер стал министром вооружений нацистской Германии, а рейхсминистр Тодт погиб в авиакатастрофе. 	2010-08-16Действие конспирологического детектива Роберта Уилсона происходит во время Второй мировой войны. 	;http://inostrankabooks.ru/ru/book/11584/
Словесные портреты;http://inostrankabooks.ru/img/book/w240/978-5-389-09214-3.jpg;Персона ;Сергей Эйзенштейн; Сергей Михайлович Эйзенштейн – выдающийся советский режиссер театра и кино, один из самых знаменитых деятелей культуры ХХ века. Еще в молодости Эйзенштейн был назван «Леонардо да Винчи кинематографа» - не только за мощь, но и за разносторонность дарований: великий режиссер, оригинальный теоретик искусства, глубокий энциклопедист, самоотверженный экспериментатор, блестящий рисовальщик, успешный педагог… И без сомнения блестящий литератор! Практически все основные зрелые труды Эйзенштейна-теоретика, разнообразные литературные опыты и мемуары представляют собою насыщенные интеллектуально, гибкие эмоционально и вольные композиционно эссе – жанр, не очень характерный для русской литературной традиции.Создавая галерею словесных портретов друзей и современников, Эйзенштейн не ставил целью дать развернутую, многостороннюю характеристику «портретируемого лица». Вспоминая в предисловии к «Мемуарам» о популярном у американцев жанре «литературного профиля», он признавался: «Я не думаю ухватить здесь профили. Дай бог закрепить изгиб брови, угол рта, прищур глаза или манеру курить сигару». На стенах этой необыкновенной галереи образы Мейерхольда, Маяковского, Малевича, Чаплина, Прокофьева... Многие из этих портретов печатались в периодике своего времени, некоторые оставались в архиве, а потом увидели свет в разнообразных посмертных изданиях автора. Один литературный этюд – “Soviet officials” («Советские чиновники»),  вместе с парным к нему рисунком – обнародован здесь впервые, как знак того, что наше знакомство с Сергеем Михайловичем Эйзенштейном еще продолжается. ;http://inostrankabooks.ru/ru/book/24614/
